FeatureClass,FeatureCode,ShortDescription,LongDescription
U,FURU,Furrow,"A closed, linear, narrow, shallow depression"
U,GAPU,Gap,A narrow break in a ridge or rise
U,GLYU,Gully,A small valley-like feature
U,HLLU,Hill,An elevation rising generally less than 500 meters
U,HLSU,Hills,Elevations rising generally less than 500 meters
U,HOLU,Hole,A small depression of the sea floor
U,KNLU,Knoll,"An elevation rising generally more than 500 meters and less than 1000 meters and of limited extent across the summit"
U,KNSU,Knolls,"Elevations rising generally more than 500 meters and less than 1000 meters and of limited extent across the summits"
U,LDGU,Ledge,"A rocky projection or outcrop, commonly linear and near shore"
U,LEVU,Levee,"An embankment bordering a canyon, valley or seachannel"
U,MESU,Mesa,"An isolated, extensive, flat-topped elevation on the shelf, with relatively steep sides"
U,MNDU,Mound,"A low, isolated, rounded hill"
U,MOTU,Moat,"An annular depression that may not be continuous, located at the base of many seamounts, islands and other isolated elevations"
U,MTU,Mountain,A well-delineated subdivision of a large and complex positive feature
U,PKSU,Peaks,"Prominent elevations, part of a larger feature, either pointed or of very limited extent across the summit"
U,PKU,Peak,"A prominent elevation, part of a larger feature, either pointed or of very limited extent across the summit"
U,PLNU,Plain,"A flat, gently sloping or nearly level region"
U,PLTU,Plateau,"A comparatively flat-topped feature of considerable extent, dropping off abruptly on one or more sides"
U,PNLU,Pinnacle,"A high tower or spire-shaped pillar of rock or coral, alone or cresting a summit"
U,PRVU,Province,A region identifiable by a group of similar physiographic features whose characteristics are markedly in contrast with surrounding areas
U,RDGU,Ridge,A long narrow elevation with steep sides
U,RDSU,Ridges,Long narrow elevations with steep sides
U,RFSU,Reefs,Surface-navigation hazards composed of consolidated material
U,RFU,Reef,A surface-navigation hazard composed of consolidated material
U,RISU,Rise,"A broad elevation that rises gently and generally smoothly, from the sea floor"
U,SCNU,Seachannel,"A continuously sloping, elongated depression commonly found in fans or plains and customarily bordered by levees on one or two sides"
U,SCSU,Seachannels,"Continuously sloping, elongated depressions commonly found in fans or plains and customarily bordered by levees on one or two sides"
U,SDLU,Saddle,"A low part, resembling in shape a saddle, in a ridge or between contiguous seamounts"
U,SHFU,Shelf,A zone adjacent to a continent (or around an island) that extends from the low water line to a depth at which there is usually a marked increase of slope towards oceanic depths
U,SHLU,Shoal,A surface-navigation hazard composed of unconsolidated material
U,SHSU,Shoals,Hazards to surface navigation composed of unconsolidated material
U,SHVU,Shelf Valley,"A valley on the shelf, generally the shoreward extension of a canyon"
U,SILU,Sill,The low part of a gap or saddle separating basins
U,SLPU,Slope,The slope seaward from the shelf edge to the beginning of a continental rise or the point where there is a general reduction in slope
U,SMSU,Seamounts,Elevations rising generally more than 1000 meters and of limited extent across the summit
U,SMU,Seamount,An elevation rising generally more than 1000 meters and of limited extent across the summit
U,SPRU,Spur,"A subordinate elevation, ridge or rise projecting outward from a larger feature"
U,TERU,Terrace,"A relatively flat horizontal or gently inclined surface, sometimes long and narrow, which is bounded by a steeper ascending slope on one side and by a steep descending slope on the opposite side"
U,TMSU,Tablemounts (Or Guyots),"Seamounts having a comparatively smooth, flat top"
U,TMTU,Tablemount (Or Guyot),"A seamount having a comparatively smooth, flat top"
U,TNGU,Tongue,An elongate (tongue-like) extension of a flat sea floor into an adjacent higher feature
U,TRGU,Trough,"A long depression of the sea floor characteristically flat bottomed and steep sided, and normally shallower than a trench"
U,TRNU,Trench,"A long, narrow, characteristically very deep and asymmetrical depression of the sea floor, with relatively steep sides"
U,VALU,Valley,"A relatively shallow, wide depression, the bottom of which usually has a continuous gradient"
U,VLSU,Valleys,"Relatively shallow, wide depressions, the bottoms of which usually have a continuous gradient"
V,BUSH,Bush(es),A small clump of conspicuous bushes in an otherwise bare area
V,CULT,Cultivated Area,An area under cultivation
V,FRST,Forest(s),An area dominated by tree vegetation
V,FRSTF,Fossilized Forest,A forest fossilized by geologic processes and now exposed at the earth's surface
V,GRSLD,Grassland,An area dominated by grass vegetation
V,GRVC,Coconut Grove,A planting of coconut trees
V,GRVO,Olive Grove,A planting of olive trees
V,GRVP,Palm Grove,A planting of palm trees
V,GRVPN,Pine Grove,A planting of pine trees
V,HTH,Heath,An upland moor or sandy area dominated by low shrubby vegetation including heather
V,MDW,Meadow,"A small, poorly drained area dominated by grassy vegetation"
V,OCH,Orchard(s),A planting of fruit or nut trees
V,SCRB,Scrubland,"An area of low trees, bushes and shrubs stunted by some environmental limitation"
V,TREE,Tree(s),A conspicuous tree used as a landmark
V,TUND,Tundra,"A marshy, treeless, high latitude plain, dominated by mosses, lichens and low shrub vegetation under permafrost conditions"
V,VIN,Vineyard,A planting of grapevines
V,VINS,Vineyards,Plantings of grapevines
V,ll,Not Available,